Не создавайте проблем сами себе.,"Если работа, которую необходимо сделать, может подождать до завтра, а выполнение ее сегодня повлечет за собой преодоление трудностей — отложите на более удобное время. "
Не оставляйте важные дела на последний день.,"Распределяйте задачи так, чтобы успеть все вовремя и избежать аврала."
Всегда собирайтесь на работу или занятия с вечера.,"Все важные вещи, деньги, ключи, одежду заранее приготовьте и сложите в одном месте. Так вы гарантированно не забудете ничего взять."
Почаще пересматривайте свои привычные методы работы.,"Кто сказал, что вы работаете на 100% эффективно?"
Не засоряйте свои рабочие места.,"Рабочее место должно оставаться рабочим, а не личным."
"Помогая человеку на работе, помни, что ты только помогаешь.",Не надо выполнять всю работу целиком. Так вы избежите неловких ситуаций после отчета о работе начальству.
"Не мешайте человеку, считающему наличные деньги.",Подождите пока человек закончит считать и затем заводите разговор.
Ведите контактный лист в телефоне как можно полнее. ,"Заносите туда e-mail, адрес, фамилии, должность и место работы, пишите заметки. Используйте Google контакты."
"Не спрашивайте у человека, сколько он зарабатывает.",Зачастую этот вопрос раздражает собеседника.
Кофе с сигаретой? Бросайте эту моду.,Перегар от кофе и сигареты разносится на весь офис и совершенно омерзителен.
У всех есть таланты. Важно помнить об этом и искать свой.,Как только вы найдете его - старайтесь развивать.
"Если спать некогда, но очень хочется — спите 15 минут.","Прямо на рабочем месте оденьте наушники, поставьте таймер на 15 минут и отключитесь от мира. "
"Многие люди не любят получать умные советы, особенно когда это еще и замаскированная критика.",Дух противоречия так и тянет сделать наперекор добрым советникам.
"Введите правило – под руками только те бумаги, которыми вы занимаетесь в данный момент.",Рабочий стол должен быть чистым.
"Поставьте на рабочем столе горшок или вазу с цветами, тарелку с яркими фруктами.","Зеленый цвет поднимет настроение. А запах базилика или мяты активизирует работу мозга, тонизирует и придает ясность мыслям. "
Выберите стул с мягкой обивкой или крутящееся компьютерное кресло с регулируемой спинкой.,Высота сидения должна быть четко отрегулирована под ваши физические параметры. 
"Вместо стандартных печенек и конфет, требуйте в офис свежие фрукты.",Это гораздо полезнее и помогает держать в тонусе тело и мозг.
Выделите место для стоянки велосипедов.,"Если хотя бы несколько сотрудников с офиса любят кататься на велосипедах, отлично было бы найти место для их хранения."
Заранее готовьтесь к собеседованиям.,"Запаситесь историями из собственной жизни, отражающими ваши лучшие качества."
На работе говорите по делу.,"Историями из собственной жизни не стоит увлекаться, пусть они будут лишь иллюстрациями вашего профессионализма."
Никогда не врите о своих навыках на работе.,Рано или поздно вранье будет замечено и может послужить поводом для увольнения.
Одевайтесь на работу опрятно.,"Не стоит выглядеть на работе страшным, небритым и одевать рваные или старые вещи. Сотрудники это не оценят."
Перестаньте стараться быть идеальным и всезнающим на работе.,"Никогда и ничто не станет таковым. Это только приводит к ложным ожиданиям, ведущим к чрезмерным стрессам в определенных ситуациях."
Перестаньте пытаться все контролировать все рабочие процессы.,"Делайте только то, что должны, не мешая другим людям делать свою работу. Доверяйте коллегам."
Избегайте чрезмерной рабочей нагрузки.,"Перерабатывая, вы можете получить серьезные проблемы со здоровьем, а недостаток личного времени может привести к ухудшению отношений в семье."
